{
  "metadata": {
    "schema_version": "0.2.0",
    "record_id": "WFS-RUN-OTF-HIST-001",
    "record_type": "WorkflowState",
    "record_revision": 1,
    "project_id": "PROJ-OTF-001",
    "run_id": "RUN-OTF-HIST-001",
    "created_at": "2026-07-27T13:47:13+08:00",
    "updated_at": "2026-07-27T13:47:13+08:00",
    "created_by": {
      "actor_id": "SYSTEM-ORCHESTRATOR",
      "actor_type": "SYSTEM",
      "role": "研究工作流状态机"
    },
    "content_classification": "REAL",
    "sensitivity_level": "INTERNAL",
    "contains_personal_data": false,
    "change_summary": "创建研究项目运行；尚未加载个人数据。"
  },
  "workflow_template": {
    "template_id": "WF-UR-V1",
    "template_version": "0.1.0"
  },
  "current_stage": "INTAKE",
  "run_status": "ACTIVE",
  "active_task_ids": [],
  "completed_task_ids": [],
  "blocked_task_ids": [],
  "artifact_registry": [],
  "approval_refs": [],
  "stale_artifact_refs": [],
  "transition": {
    "event_id": "EVT-00001-5C869F62",
    "event_type": "PROJECT_CREATED",
    "from_stage": null,
    "to_stage": "INTAKE",
    "triggered_by": {
      "actor_id": "SYSTEM-ORCHESTRATOR",
      "actor_type": "SYSTEM",
      "role": "研究工作流状态机"
    },
    "occurred_at": "2026-07-27T13:47:13+08:00",
    "reason": "创建研究项目运行；尚未加载个人数据。",
    "related_task_ids": [],
    "related_artifact_refs": []
  }
}
