{
  "metadata": {
    "schema_version": "0.1.0",
    "record_id": "WFS-DEMO-001",
    "record_type": "WorkflowState",
    "record_revision": 5,
    "project_id": "PROJ-DEMO-001",
    "run_id": "RUN-DEMO-001",
    "previous_record_ref": {
      "record_id": "WFS-DEMO-001",
      "record_type": "WorkflowState",
      "record_revision": 4
    },
    "created_at": "2026-07-23T09:30:00+08:00",
    "updated_at": "2026-07-23T09:30:00+08:00",
    "created_by": {
      "actor_id": "SYSTEM-ORCHESTRATOR",
      "actor_type": "SYSTEM",
      "role": "研究工作流状态机"
    },
    "content_classification": "SYNTHETIC",
    "sensitivity_level": "INTERNAL",
    "contains_personal_data": false,
    "change_summary": "研究方案任务完成，进入研究工具设计阶段。"
  },
  "workflow_template": {
    "template_id": "WF-UR-V1",
    "template_version": "0.1.0"
  },
  "current_stage": "INSTRUMENT_DESIGN",
  "run_status": "ACTIVE",
  "active_task_ids": [
    "TASK-DEMO-003"
  ],
  "completed_task_ids": [
    "TASK-DEMO-001",
    "TASK-DEMO-002"
  ],
  "blocked_task_ids": [],
  "artifact_registry": [
    {
      "artifact_ref": {
        "artifact_id": "RB-DEMO-001",
        "artifact_type": "ResearchBrief",
        "artifact_version": "0.1.0",
        "approval_id": "APR-DEMO-G1-001"
      },
      "workflow_validity": "CURRENT"
    },
    {
      "artifact_ref": {
        "artifact_id": "RP-DEMO-001",
        "artifact_type": "ResearchPlan",
        "artifact_version": "0.1.0"
      },
      "workflow_validity": "CURRENT"
    }
  ],
  "approval_refs": [
    {
      "artifact_id": "APR-DEMO-G1-001",
      "artifact_type": "ApprovalRecord",
      "artifact_version": "0.1.0"
    }
  ],
  "stale_artifact_refs": [],
  "transition": {
    "event_id": "EVT-DEMO-005",
    "event_type": "TASK_SUCCEEDED",
    "from_stage": "PLAN_DESIGN",
    "to_stage": "INSTRUMENT_DESIGN",
    "triggered_by": {
      "actor_id": "SYSTEM-ORCHESTRATOR",
      "actor_type": "SYSTEM",
      "role": "研究工作流状态机"
    },
    "occurred_at": "2026-07-23T09:30:00+08:00",
    "reason": "ResearchPlan 已生成并通过结构校验与研究质量预审，可以按方法实例设计研究工具。",
    "related_task_ids": [
      "TASK-DEMO-002"
    ],
    "related_artifact_refs": [
      {
        "artifact_id": "RP-DEMO-001",
        "artifact_type": "ResearchPlan",
        "artifact_version": "0.1.0"
      }
    ]
  }
}
